,id,ad_creative_body,Typology 1,Typology 2,Typology 3,Typology 4
212,id338212380523776,"The U.S. Pipeline Safety and Hazardous Material Administration (PHMSA) issues minimum safety standards for the design, construction, inspection and operation of natural gas pipelines.",PA,,,
213,id211699609973645,We've just taken off flying a banner around the Permian Basin to thank essential oil and gas workers! Look up and see the names of Texans that support this critical work.,,,,
214,id263623098258665,"Conservation and energy production are not mutually exclusive, and Texas' oil and natural gas industry is taking action to ensure that our state's species and habitats are not adversely affected.",CA,PA,GA,
215,id190988865596772,"Tune in FRIDAY at 4:30pm to our panel conversation on being pro-environment and pro-industry with Benji Backer, President of American Conservation Coalition (ACC), and Matthew Wiltshire, an ACC member and the President of Houston Young Republicans. Both share their unique perspectives on embracing energy while advancing environmental causes.",,,,
216,id955101764944511,"The last few months have proven to be some of the most challenging times we have faced as a nation. Fortunately, the oil and natural gas industry in Texas has stepped up to provide critical assistance to those in need across our state and beyond.",CA,,,
217,id534907323873423,The city of Dallas MUST accept natural gas as a safe and affordable form of energy.,PA,GC,,
218,id274528943700577,"Did you know? By switching from coal to cleaner-burning natural gas for power generation, the United States prevented 2.8 billion metric tons of CO2 emissions between 2005 and 2018. The CECAP is wanting to phase out natural gas.",GC,,,
219,id697863240790368,"Natural gas accounts for nearly 45 percent of the state of Texas’ fuel mix. With the CECAP looking to phase out this source of energy, what would happen to the hundreds of thousands of Texans who rely on natural gas?",PA,,,
220,id2614527498648708,"From production to pipelines and exports to energy policy, we have the experts ready to answer your questions about anything related to oil and natural gas.",,,,
221,id262955001562109,Pipelines are dated at the time they are manufactured and coated with a protective layer.,PA,,,
222,id564641491118832,Don’t judge a pipe by its date or a book by it's cover. Learn more about how pipelines are dated.,PA,,,
223,id3150732998356562,"Pipeline coatings protect pipe from external factors like high stress, UV light and even in the Texas heat.",PA,,,
224,id4460687663956633,Did you know? Pipelines are treated with a special coating – like Fusion Bonded Epoxy – which is resistant to high temperatures and protects the pipe from corrosion.,PA,,,
225,id180917546410814,Pipelines in the Permian Basin play a crucial role in ensuring the safe and efficient delivery of the energy we use every day.,PA,,,
226,id650486332178382,"As we transition to natural gas as our energy source, pipelines continue to be the most environmentally friendly option.",PA,,,
227,id256638405482067,More pipelines in the Permian Basin means less CO2 and other greenhouse gas emissions.,GA,,,
228,id540907793508508,Pipelines are the safest and most efficient way to transport oil and natural gas.,PA,,,
229,id509377423091708,"We are Texans from all across the state who support oil and natural gas. 

Thank you for your continued support!",,,,
230,id199935984640691,Want to have a chance every single month to win a free oil & gas prize? Join our Facebook group to enter our monthly contests!,,,,
231,id613743792507765,"There’s an online community of like-minded Texans for oil & natural gas waiting for you! Join us today for group discussion, giveaways for special prizes and more!",,,,
232,id1087467084986168,Want to enter into a contest to get a FREE prize from us every month? Join our Facebook Group today! The official TNG Facebook group is the only way to enter into these exclusive giveaways!,,,,
233,id216377449479329,"Hear directly from those who have worked and benefited from the natural resources available in the Permian Basin in episode one of our new series, Voices of Texas Oil below ⬇️",SA,CB,CA,
234,id3127849910579872,"Pipelines are good for the Texas economy and have a 99.999% safety record. Sign the pledge, support the Permian Highway Pipeline.",CA,CB,PA,
235,id473918299970399,"Pipelines are good for the Texas economy, improve air quality, and have a 99.999% safety record. Sign the pledge, support the Permian Highway Pipeline.",CA,CB,PA,
236,id1037807713242629,"🚨ATTENTION PIPELINE SUPPORTER 🚨
We need your help to combat fake news being spread about the Permian Highway Pipeline. Can you help out? If so, click Send Message below and help support the Texas economy.",,,,
237,id114252370013314,"🚨ATTENTION PIPELINE SUPPORTER 🚨
We need your help to combat fake news being spread about the Permian Highway Pipeline. Are you willing to write a letter to the editor? If so, click Send Message below and help support the Texas economy.",,,,
238,id1544773085674283,"🚨ATTENTION PIPELINE SUPPORTER 🚨
We need your help to combat fake news being spread about the Permian Highway Pipeline. Are you willing to attend an in-person event? If so, click Send Message below and help support the Texas economy.",,,,
239,id573113716575978,ATTENTION HAYS COUNTY: Don't let your County officials block pipeline construction in Texas! Click below to send your County officials an email and show that you support Texas pipelines!,,,,
240,id509552129667940,🚨HAYS COUNTY🚨: Your County officials are considering using taxpayer dollars to fund a lawsuit aiming to block the Permian Highway Pipeline! Send your officials an email today to tell them you support Texas pipelines and all the benefits they bring!,,,,
241,id465007054147739,"Introducing… THE CRUDE CREW! Keeping the world moving using the power of oil & natural gas, especially your friends with electric cars! Watch their new commercial now:",PA,,,
242,id467056344269251,The Transportation & Climate Initiative will help reduce NY’s #1 source of emissions – and let the economy thrive.,GA,,,
243,id343908773386168,Read our op-ed in The Providence Journal on how #TCI protects the economy and the environment at the same time.,GA,,,
244,id310254166943926,Businesses agree: PA doesn’t have to choose between the environment and economy. RGGI solves for both.,GA,,,
245,id326831498645079,"TCI will improve infrastructure, add jobs and increase GDP – all while cutting emissions. A win-win for NY.",GA,,,
246,id770533327056555,TCI is a carbon price on transportation. It’s a smart way to grow the economy and reduce emissions at the same time.,GA,,,
247,id1008153822931420,"TCI will improve infrastructure, add jobs and increase GDP – all while cutting emissions. A win-win for NJ.",GA,,,
248,id629296714279418,"TCI will improve infrastructure, add jobs and increase GDP – all while cutting emissions. A win-win for VA.",GA,,,
249,id2726370844289573,"TCI will improve infrastructure, add jobs and increase GDP – all while cutting emissions. A win-win for MA.",GA,,,
250,id377806390064404,"TCI will improve infrastructure, add jobs and increase GDP – all while cutting emissions. A win-win for CT.",GA,,,
251,id403670507300840,"TCI will improve infrastructure, add jobs and increase GDP – all while cutting emissions. A win-win for RI.",GA,,,
252,id361394491907894,"TCI will improve infrastructure, add jobs and increase GDP – all while cutting emissions. A win-win for MD.",GA,,,
253,id362885731756603,"TCI will improve infrastructure, add jobs and increase GDP – all while cutting emissions. A win-win for DE.",GA,,,
254,id327792575094720,"Why advocate for carbon pricing? Because it’s good for the people of Illinois, good for business, and good for the planet.",GA,,,
255,id353022199070989,"TCI puts a carbon price on transportation. It will cut emissions, improve infrastructure and create jobs DE needs right now.",GA,,,
256,id1243820179330687,"TCI puts a carbon price on transportation. It will cut emissions, improve infrastructure and create jobs MD needs right now.",GA,,,
257,id3874846962544318,"TCI puts a carbon price on transportation. It will cut emissions, improve infrastructure and create jobs RI needs right now.",GA,,,
258,id789875238444403,"TCI puts a carbon price on transportation. It will cut emissions, improve infrastructure and create jobs MA needs right now.",GA,,,
259,id826527204822223,"TCI puts a carbon price on transportation. It will cut emissions, improve infrastructure and create jobs CT needs right now.",GA,,,
260,id431157951179851,"TCI puts a carbon price on transportation. It will cut emissions, improve infrastructure and create jobs NJ needs right now.",GA,,,
261,id357722765319809,"TCI puts a carbon price on transportation. It will cut emissions, improve infrastructure and create jobs VA needs right now.",GA,,,
262,id316962216270055,"TCI puts a carbon price on transportation. It will cut emissions, improve infrastructure and create jobs NY needs right now.",GA,,,
263,id250728292602450,"America needs a model for carbon pricing. It can start in VA. Let’s
make the Transportation and Climate Initiative law.",GA,,,
264,id513048996021706,America needs a model for carbon pricing. It can start in CT. Read our op-ed.,GA,,,
265,id227537708427665,America needs a model for carbon pricing. PA can help. Read our op-ed on the Regional Greenhouse Gas Initiative.,GA,,,
266,id385038962793138,"We take immense pride in being good stewards of the environment and reducing our footprint, a practice we have incorporated into our daily operations for more than 10 years. 
Our commitments include protecting and preserving the environment, conserving our country’s natural resources as we conduct our business, and reducing emissions throughout our operations.
Learn more about our environmental management practices: https://energytransfer.com/emissions-innovation/",GA,,,
267,id1718117671679453,"The Pennsylvania Game Commission recently approved the expansion of game lands in the Commonwealth by 229 acres made possible by a donation from Energy Transfer’s wholly owned subsidiary, Regency Marcellus Gas Gathering, LLC.

Blog Post: https://energytransferfacts.com/blog/newly-donated-land-becomes-protected-habitat-in-pennsylvania/

#Conservation #Pipelines #Habitat",CA,,,
268,id3458999957527638,"“Growing up next to the Marcus Hook facility and now living with my family in Aston, our relationships with Aston Township Fire and the other local departments mean a lot to me,” said Joe McGinn, Vice President, Public Affairs at Energy Transfer. “We are honored to maintain a close partnership with Chief Evans and the team, and to show support through monetary grants, volunteer support and trainings.” 

Last Friday, Energy Transfer representatives toured the construction site of Aston Twp. Fire Dept.'s new state-of-the-art facility, and presented a $44,014.80 grant for new equipment.

“Between rising operations costs and having to cancel our primary fundraisers this year due to the pandemic, our fire department is essentially ‘breaking even,’” said Aston Township Fire Chief Mike Evans. “This grant from Energy Transfer, along with grants from Aston Township and the state of Pennsylvania, came at the perfect time and will allow us to better serve our community as we work to build a new, state-of-the-art facility.”
@astontwpfd

#EnergyTransfer #MarinerEast2 #Pipelines #Donate #GivingBack #ETcares #MarcusHook #FirstResponders #Firefighters #Sponsor #GoodNews #OilandGas #Energy",CA,,,
269,id3364837946937820,Mariner East supports local labor unions by working with skilled union craftsmen & women.,CB,,,
270,id2768860596730221,Mariner East supports PA labor unions by working with skilled union craftsmen & women.,CB,,,
271,id1042196642921573,"Across PA, Mariner East supports family-sustaining opportunities for skilled laborers.",CB,,,
272,id3515502558539014,The Marcus Hook Industrial Complex is fueling Delco's economic prosperity.,CA,CB,,
273,id2790326584546595,Propane stored and processed at MHIC is used to make essential items like hand sanitizer.,PB,,,
274,id688824141739020,Horizontal directional drilling is a safe and common pipeline installation technology.,,,,
275,id805024466991977,"When pipeline construction is complete, we restore land to its original state or better.",GA,,,
276,id1037903153300249,Local skilled union workers receive robust training to ensure our pipelines are constructed safely,PA,,,
277,id788410868604376,Propane stored and processed in PA is used to make essential items like hand sanitizer.,PB,,,
278,id390480188788315,Local skilled union workers receive robust training to ensure our pipelines are constructed safely.,PA,,,
279,id702426883952405,We are committed to safe operations and construction of Mariner East at all times.,PA,CB,,
280,id983003708873564,Skilled workers are committed to safe operations and construction of Mariner East at all times.,PA,CB,,
281,id665427494095018,The Marcus Hook Industrial Complex is lowering CO2 emissions & bettering PA’s environment.,GA,,,
282,id802573033834587,Public safety comes first. We continuously train and support first responders in communities along our pipelines.,,,,
283,id706042303335686,Skilled union workers are committed to safe operations and construction of Mariner East at all times.,PA,CB,,
284,id762970811126553,"#FACT:
99.98% of the Dakota Access Pipeline is installed on privately owned property in North Dakota, South Dakota, Iowa, and Illinois. Landowners were paid for the easement and can continue to use the land for farming and ranching.
The pipeline does not enter the Standing Rock Sioux reservation.

Learn more: https://daplpipelinefacts.com/

#DAPL #DakotaAccess #Pipelines #DAPLfacts #EnergyTransfer #Pipelinefacts #Oil",,,,
285,id1022787421486554,"#FACT: We believe that meaningful consultation and ongoing communications with all stakeholders are key to environmentally responsible energy infrastructure.

These collaborative relationships enable us to meet our country's energy needs, promote economic prosperity, and foster America's energy independence.

To learn more facts visit: https://daplpipelinefacts.com/The-Facts.html

#DAPL #DakotaAccess #Pipelines #Oil #Community #Respect #SocialResponsibility",PA,SA,CA,
286,id324206988775767,"GET THE FACTS: Regarding our work at Shoen Road in Chester County, both the Pennsylvania DEP and the local water supplier have confirmed that drinking water has NOT been impacted. Read more: https://bit.ly/3iL7yDJ",,,,
287,id360780634910724,"#FACT: The Standing Rock Sioux Tribe's new water intake is more than 75 miles away from the Dakota Access Pipeline route across Lake Oahe.

But rail lines that can transport crude oil cross the Tribe's reservation and Lake Oahe only two miles upstream of the Tribe's new water intake.

Learn more facts at:  https://daplpipelinefacts.com/The-Facts.html

#DAPL #DakotaAccess #Pipeline #Facts #DAPLalternativeFacts #Bakken #Oil",,,,
288,id676837623179128,"#FACT
There are twelve other pipeline crossings along the Missouri River north of the Dakota Access Pipeline.

Learn more:  https://daplpipelinefacts.com/The-Facts.html
 
Around Lake Oahe, DAPL tracks both the Northern Border Gas Pipelines and an existing overhead utility line.  

Dakota Access chose this route because these locations had been disturbed in the past – both above and below ground level – making it a ‘brownfield crossing location.’  This made it less likely, then, that new ground disturbances would harm intact cultural or tribal features. 

#DAPL #DakotaAccess #Pipeline #Bakken #Truth #DAPLalternativeFacts",,,,
289,id1241716629505173,"The #DakotaAccess #Pipeline has been safely operating since June of 2017 and, contrary to some reports, no groundwater has been impacted in any of the four states through which it passes.

#DAPL #Facts #DakotaAccessPipeline #DAPLalternativeFacts",,,,
290,id770997703709219,"#FACT: The Dakota Access Pipeline conducted cultural surveys and adjusted the route 140 times in North Dakota alone to avoid potentially historic sites.

During the preliminary surveys in 2014, we invited input from the Tribe’s Historic Preservation Officer and sent her the centerline files to review. We never received a response.

Learn more: https://daplpipelinefacts.com/The-Facts.html

#DAPL #DakotaAccess #Pipeline #Facts",,,,
291,id751293088972159,"The U.S. Army Corps of Engineers had hundreds of contacts with dozens of tribes while the #DakotaAccess project was reviewed. 

More facts: https://daplpipelinefacts.com/The-Facts.html

The Corps made dozens of attempts to consult the Standing Rock Sioux Tribe to discuss archaeological and other surveys before finalizing the pipeline route. 

The Corps did receive responses from other tribes and the North Dakota's State Historic Preservation Officer (SHPO).

#DAPL #DakotaAccessPipeline #DAPLfacts #EnergyTransfer #Facts",,,,
292,id224893002031360,"#FACT
There have been no spills on the pipeline’s 1,200 miles of underground mainline pipe, which includes the Lake Oahe crossing and all other water bodies. 
There were a few small incidents that occurred on our property of which the largest was less than 2 barrels, all of which were immediately contained and fully remediated.

https://daplpipelinefacts.com/The-Facts.html

#DAPL #DakotaAccessPipeline",PA,,,
293,id2726853344210203,"#FACT
The #DakotaAccessPipeline does not encroach or cross any land owned by the Standing Rock Sioux Tribe.
By contrast, rail lines that can transport crude oil from wells owned by Native American tribes currently cross the Standing Rock reservation without objection.

https://daplpipelinefacts.com/The-Facts.html",,,,
294,id285255272928317,"#FACT
The #DakotaAccessPipeline adhered to all federal, state, and local laws and regulations. All told, more than 1,000 certificates, permits and approvals were granted for the pipeline -- that's about one permit or approval for every mile of pipeline.

https://daplpipelinefacts.com/The-Facts.html",,,,
295,id1028974037556316,"Energy Transfer proudly supports first responders and the important work they do in our communities. We are happy to sponsor the Suffield Township Fire Department in Portage County, Ohio with $15,793 toward the purchase of new sets of protective turnout gear.

#EnergyTransfer #GivingBack #Pipelines #OilandGas",CA,,,
296,id602493040671857,"Multiple elected officials, industry groups and unions came out in opposition to today's decision by the U.S. District Court regarding the Dakota Access Pipeline. Read a collection of their statements in our latest blog post.

https://energytransferfacts.com/blog/responses-to-dakota-access-pipeline-decision/

#DakotaAccessPipeline #DAPL #DakotaAccess #Pipelines #NorthDaktoa #Oil #Pipeline #Blog #EnergyNews #MediaStatement #Facts #EnergyTransfer",,,,
297,id606358826643976,"America will move tomorrow because of the oil and gas produced today. Dakota Access Pipeline is proud to stand alongside the more than 14,000 oil and gas workers in Illinois who work in the production fields, along the pipelines, and in the Illinois refineries. We are helping provide the energy that makes our economy strong, and our communities stronger.",PA,,,
298,id2603811789839043,"The Dakota Access Pipeline is currently moving approximately half of the Bakken’s oil output per day. Optimizing the existing pipeline by adding horsepower will help allow for further development in the Bakken, economic growth in North Dakota, and the stabilization of costs for the industry and consumers.

#DAPL #DakotaAccess #SupportDAPL #NorthDakota #Bakken #Oil #Pipelines #DakotaAccessPipeline",CA,PA,,
299,id2694869447395968,"With a population of nearly 13 million people, the state of Illinois is an important economic hub in the Midwest. But what most residents don’t realize is that Illinois plays a critical role in our nation’s energy security. Illinois leads the Midwest in refining capacity and is home to the Patoka Terminal, one of the busiest crude oil storage hubs in the region. 

The Patoka Terminal is a crossroads for pipelines in southern Illinois where crude oil is stored and then delivered to refineries where it is transformed into gasoline, propane, and other usable energy by-products.",SA,,,
300,id720674165366214,"At Energy Transfer, we believe in fostering a culture of trust and respect within our organization, and with whom we do business. We listen to, and understand, stakeholder' concerns while negotiating honestly and in good faith. #EnergyTransfer #DoingItRight",,,,
301,id550918038916436,"At Energy Transfer, we are committed to being a good neighbor and business partner in the communities in which we operate.
That means supporting many types of organizations, causes and local initiatives across the 38 states through both direct donations and our employee volunteer program. These commitments are held as fundamental core values and are an integral part of who we are as a corporate citizen. #EnergyTransfer #DoingItRight #ETcares",CA,,,
302,id739983376753048,We are #Committed2PA by supporting first responders & health care workers on the front lines who keep our communities safe.,CA,,,
303,id283203969400293,"Energy Transfer is #Committed2PA by safely transporting ethane & propane, the building blocks of essential medical supplies.",PB,,,
304,id297355285003782,Energy Transfer is #Committed2PA by supporting first responders & health care workers who help keep our communities safe.,CA,,,
305,id1443564139149965,"We are #Committed2PA by safely transporting NGLs, including ethane & propane, the building blocks of essential medical supplies.",PB,,,
306,id262264014839491,"Energy Transfer is committed to protecting and preserving the environment and to conserving our country's natural resources as we conduct our business. We are committed to using our resources responsibly and efficiently, and to reducing emissions throughout our operations. #EnergyTransfer #DoingItRight",GA,,,
307,id543087839695737,"At Energy Transfer, we understand the importance of moving our industry forward with a keen eye to embracing technology that not only reduces emissions, but helps us to operate more efficiently. #EnergyTransfer #DoingItRight",GA,,,
308,id2311689399140590,"Energy Transfer has long-standing commitments to the safety of people, the environment, and our property and assets. We do this not just because it makes good business sense, but also because it's the right thing to do.

#EnergyTransfer #DoingItRight",PA,,,
309,id2453078014795259,Energy Transfer has expanded measures to keep everyone safe & healthy while delivering the energy used to make critical products.,PB,,,
310,id692071374904991,"Americans rely on safe, efficient infrastructure—from our roads, bridges and railways, to our electrical grid and energy pipelines. America’s oil production will remain critically important as our economy recovers from COVID-19 and the OPEC oversupply. 

Our latest blog post explains why the Dakota Access Pipeline is an important part of the mix, supporting our energy needs and modern way of life.

#DAPL #DakotaAccess #EnergyTransfer",PA,,,
311,id1763799443759232,"Pipeline workers deliver the energy products we rely on, & they are taking extra precautions to keep communities & each other safe.",,,,
312,id177324180170331,"Energy Transfer is proud to move the energy that powers our supply chain, fuels our connections, and makes life-saving medications possible. 

We salute those on the front lines taking care of our families, neighbors and communities.",PB,,,
313,id226511028640370,"Energy Transfer is proud to move the energy that powers our supply chain, fuels our connections, and makes life-saving medications possible. Protective medical gear such as synthetic rubber gloves is made from petroleum that is transported through our underground pipelines. 

We salute those on the front lines taking care of our families, neighbors and communities.",PB,,,
314,id239467337273542,"Energy Transfer is proud to move the energy that powers our supply chain, fuels our connections, and makes life-saving medications possible. Natural gas transported through our underground pipelines heats our homes, fuels our cooking, and is essential in pharmaceutical production.

We salute those on the front lines taking care of our families, neighbors and communities.",PA,PB,,
315,id258421895545113,"Energy Transfer is proud to move the energy that powers our supply chain, fuels our connections, and makes life-saving medical equipment possible.

We salute those on the front lines taking care of our families, neighbors and communities.",PB,,,
316,id274183800283105,"Energy Transfer is proud to move the energy that powers our supply chain, fuels our connections, and makes life-saving medications possible. Isopropyl (“rubbing”) alcohol in hand sanitizers is derived from propane that is transported through our underground pipelines. 

We salute those on the front lines taking care of our families, neighbors and communities.",PB,,,
317,id737389663745686,"Energy Transfer is proud to move the energy that powers our supply chain, fuels our connections, and makes life-saving medications possible. Plastic medical equipment such as MRI machines and heart valves are made from petroleum that is transported through our underground pipelines. 

We salute those on the front lines taking care of our families, neighbors and communities.",PB,,,
318,id888855224858736,"Energy Transfer is proud to move the energy that powers our supply chain, fuels our connections, and makes life-saving medications possible. Protective medical gear such as plastic eyewear is made from petroleum that is transported through our underground pipelines. 

We salute those on the front lines taking care of our families, neighbors and communities.",PB,,,
