,id,ad_creative_body,Typology 1,Typology 2,Typology 3,Typology 4
582,id279435806356895,"America's recovery is going to take energy, and we have a choice on how we get it. Why import from unstable regions when we can responsibly produce right here in America?",SA,,,
583,id331459264823303,Extreme environmental policies could threaten more than 10 million good-paying jobs in communities across America.,CB,,,
584,id810810596340740,“The Pennsylvania shale energy industry has worked tirelessly to help our nation become energy independent and we need political leaders who are ‘all in’ and passionately embrace and support this effort.”,SA,,,
585,id818909348854563,"""In the states that will actually decide the election,"" the LA Times reports, ""local issues often matter more. In this corner of America [Pennsylvania], that means fracking.""

Read more about the broad, bipartisan support for natural gas development.",,,,
586,id697622700831999,"""We need bipartisan support for natural gas if we want to keep our economy growing, energy rates down and movement in the right direction toward a cleaner energy future.""",CA,PA,GC,
587,id362352674802361,Stay informed and join us by Standing up for American Energy.,SA,,,
588,id1204785246573300,Making natural gas even more efficient is a win for the economy and the environment. Learn how our engineers are designing new turbines that’ll top their own records for efficiency.,GC,,,
589,id380041946727310,Natural gas is already affordable and efficient—and it’s getting better every day. Learn about how we’re designing new turbines that will make natural gas more efficient than ever before.,PA,,,
590,id670560313561500,Natural gas powers nearly 1/3 of the US. Learn how it's converted into electricity for millions of American homes and businesses.,PA,,,
591,id803320707142383,While we spend more time indoors natural gas is creating the energy we need to stay connected. Learn how.,PA,,,
592,id701027140452900,Learn how a chemical engineering professor at UT-Austin is working at the intersection of energy and the environment to ensure safe development of reliable natural gas.,PA,GC,,
593,id774219399998320,"Natural gas helped reduce CO2 emissions to the lowest levels in a generation. Now a UT-Austin professor is helping us reduce methane, an even stronger greenhouse gas.",GC,,,
594,id794719114632295,Let’s work together to find climate solutions while meeting our essential energy needs.,GA,,,
595,id665500694061770,We’ve reduced CO2 emission levels to the lowest in a generation.,GA,GC,,
596,id680192809242600,We can tackle climate change and meet the world's energy needs by embracing new innovations together.,GA,,,
597,id353997432440255,"Through innovative partnerships, we've reduced CO2 emissions to the lowest in a generation—and now we're working to reduce methane, too.",GC,,,
598,id326550045357281,How can we keep reducing CO2 emissions and meet our essential energy needs?,GA,,,
599,id960409134427486,"What does it take to reduce emissions? Tech, better processes, and smart people — like Chevron’s manager of carbon reduction.",GA,,,
600,id1174956719537603,How are natural gas and oil companies helping cars emit less CO2? They’ve developed engine oils that improve fuel efficiency. See the science.,GA,,,
601,id637186850539435,What can the natural gas and oil industry do to reduce methane emissions even further? Colorado State’s Dan Zimmerle has a few ideas.,GC,,,
602,id923817301436685,Natural gas and oil companies have teams dedicated to cutting greenhouse gases. Meet Chevron’s manager of carbon reduction and learn more.,GA,,,
603,id2676275452589051,Did you know natural gas and oil companies are working to keep grizzly bears safe? Learn how collaboration is protecting wildlife.,CA,,,
604,id310900223697095,Solar helps power natural gas production in TX & CA: learn more about the partnerships that help keep America the world leader in reducing emissions.,GC,,,
605,id318162086292688,"Reducing emissions requires collaboration, tech, and dedicated people — like Vanessa Ryan, Chevron’s manager of carbon reduction.",GA,,,
606,id1476905782493789,How did we eliminate an extra 12k tons of greenhouse gas emissions? By finding innovative ways to transport water used to produce energy – see how!,GA,,,
607,id295481511730616,"American energy security lays the foundation for our national security and the innovation needed to power the future.

America’s natural gas and oil companies are proud of the progress that’s been made, and will continue to find new ways to support our country’s economic, environmental, and global leadership. 

Sign up to stay informed!",SA,CA,,
608,id317018426327295,"We can all agree we need strong climate solutions—and with natural gas as a dominant energy source, U.S. carbon emissions are the lowest levels in a generation.",GC,,,
609,id901235043731783,"We can all agree we need strong climate solutions—and with natural gas as a dominant energy source, U.S. carbon emissions are the lowest in a generation.",GC,,,
610,id1274315339578302,We’ve reduced CO2  emission levels to the lowest in a generation.,GA,GC,,
611,id1500984310104929,Support oil and natural gas producers who work every day to safely produce energy for New Mexico and America while protecting our communities and neighbors.,PA,,,
612,id225862101836416,"Natural gas is already clean, affordable and efficient—and it’s getting better every day. Learn about how we’re designing new turbines that will make natural gas more efficient than ever before.",PA,,,
613,id601287137447436,"Learn how one man’s mission to protect the environment led to a collaboration between environmental groups, the EPA, and natural gas and oil companies.",GA,,,
614,id330467755009578,Making clean and efficient natural gas even more efficient is a win for the economy and the environment. Learn how our engineers are designing new turbines that’ll top their own records for efficiency.,GC,,,
615,id304711617394303,American energy – delivering what's essential.,PB,PA,,
616,id2366742906961711,"Innovation is part and parcel to America’s energy industry. And our energy innovators will continue to work towards solutions that power our tomorrow more cleanly, efficiently, and reliably. Add your name to stay up to date!",PA,GA,,
617,id3009252385825849,"#DidYouKnow the Land Water Conservation Fund -  America’s largest federal conservation program - is funded almost entirely by offshore oil and natural gas production? 

In 2018 alone, the LWCF allocated $893 million to support a range of conservation programs including rehabilitating parks, improving wildlife habitats, expanding hiking trails, and more.",CA,,,
618,id549289212672872,Thank you to all those keeping us safe. We're sending good energy your way. https://bit.ly/2WkaDSM,PA,,,
619,id598868287654230,"""[I]ndustry is already reducing production on its own. By allowing the free market to work, producers can determine for themselves what level of production is economical.""",,,,
620,id1395685887283383,Limiting Texas oil and natural gas means other nations will provide the energy the world needs. Keeping Texas strong keeps America strong. Tell the RRC to say no to production quotas!,SA,,,
621,id647636539126489,Limiting oil and natural gas production is bad for business in Texas. Keeping Texas strong keeps America strong. Say no to restricting Texas energy with energy production quotas.,CA,,,
622,id1142436342764581,Limiting Texas oil and natural gas means other nations will provide the energy the world needs. Keeping Texas strong keeps America strong. Say no to restricting Texas energy with production quotas.,SA,,,
623,id260939958367851,"Employees at a PA petrochemical plant worked ""all day and night for a month straight, producing tens of millions of pounds of the raw materials that will end up in face masks and surgical gowns worn on the front lines of the pandemic."" Read their story: https://wapo.st/3btADQJ",PB,,,
624,id856084088223463,How did we eliminate an extra 12k tons of greenhouse gas emissions? By finding innovative ways to transport water used to produce energy – see how: https://bit.ly/2VsdtVl #EarthDay #EarthDayProgress,GA,,,
625,id271259737244923,Did you know natural gas and oil companies are working to keep grizzly bears safe? Learn how collaboration is protecting wildlife. https://bit.ly/2VtlZ6m,CA,,,
626,id295995048377403,"This #EarthDay we reflect on the public health challenge that is impacting the globe. Yet we're not taking our eye off driving continued environmental progress, specifically efforts to address climate change, while we deliver the energy the world needs. https://bit.ly/357jWIF",GC,,,
627,id582912722581647,"Learn how one man’s mission to protect the environment led to a collaboration between environmental groups, the EPA, and natural gas and oil companies. #EarthDay #EarthDayProgress https://bit.ly/2KrJgQ0",GA,,,
628,id549263442455441,"What does it take to reduce emissions? Tech, better processes, and smart people — like Chevron’s manager of carbon reduction. Learn how: https://bit.ly/3ePVTCq",GA,,,
629,id629381700948013,Limiting Texas oil and natural gas means other nations will provide the energy the world needs. Keep Texas strong keeps America strong. Tell the RRC to say no to production quotas!,SA,,,
630,id216902532762804,The pipeline industry develops consensus-based best practices to protect our energy infrastructure.,PA,,,
631,id261605944832475,The natural gas and oil industry uses cutting edge technology and collaboratively developed best practices to defend itself and energy consumers against cyber threats.,PA,,,
632,id1124853411240018,"The natural gas and oil industry is deeply engaged in efforts to understand cyber threats, coordinate with experts and stay ahead of our adversaries.",PA,,,
633,id2430703010593467,"American energy is helping to revive communities. From coast to coast, natural gas and oil development is energizing economies and improving millions of lives.",CA,,,
634,id1527641567396234,U.S. energy leadership offers our nation stability and insulates us from hostile and unreliable suppliers.,SA,,,
635,id200389521272821,"The U.S. is the world’s leading producer and now a net energy exporter – reducing energy poverty, lowering global emissions, raising standards of living, and supporting the uptake of renewable energy.",SA,GA,PA,
636,id523524025232396,"Natural gas and oil power America’s 21st-century economy, strengthen our nation’s security and support U.S. global leadership in reducing greenhouse gases. #EnergyForProgress",CA,SA,,
637,id202900447623335,"Constant innovation, smart regulations, collaborative efforts, and industry initiatives help to ensure that industry is providing affordable and reliable energy to consumers, while reducing its environmental footprint and emissions. #EnergyForProgress",PA,GA,,
638,id227166501746212,It takes hard work to develop affordable solutions that meet rising demand for energy while addressing the risks of climate change. But our industry is constantly innovating to meet this dual challenge. #EnergyForProgress,PA,GA,,
639,id2385954481505969,"What can we achieve when we explore new ideas and find common ground in innovative partnerships? Learn how America’s natural gas and oil companies are making a difference locally, nationally and globally.",GA,,,
640,id249357839392782,"Pipelines are the safest and most efficient way to transport natural gas and oil. Infrastructure expansion will ensure that our abundant, homegrown energy reaches American households and businesses.",PA,,,
641,id2614297565495109,"The Line 3 replacement will prioritize safety, utilizing high tech tools and around-the-clock monitoring to protect the environment while ensuring safe delivery of energy to consumers.",PA,,,
642,id193461995300088,“Allowing Line 3 to proceed is the best way to protect the environment in Minnesota and beyond.”,PA,,,
643,id2612331889012604,"The Line 3 replacement will keep energy flowing in Minnesota and costs low for working families. Plus, it ""would come equipped with the latest technology for the prevention and early detection of spills.""",PA,,,
644,id2790515281024723,"One of Pennsylvania’s greatest advantages is its clean, affordable, reliable, and accessible energy. 

Adding new taxes will only further burden our already-highly taxed natural gas industry and could mean higher energy costs for Pennsylvania families and businesses.",PA,GC,,
645,id188524339080748,"Pennsylvania's existing impact tax has already produced nearly $1.7 billion in funds that pay for roads, parks, public safety, and other essential services. 

The Governor's new plan unnecessarily jeopardizes hundreds of thousands of jobs and much-needed local and state tax revenue.",CA,CB,,
646,id204408587429589,"The “Restore Pennsylvania” plan puts family-supporting jobs and millions of dollars’ worth of funding for infrastructure and community projects at risk. 

➡️ Risks hundreds of thousands of jobs 
➡️ Jeopardizes on average $200+ million in annual funding   
➡️ Hurts all 67 counties",CA,CB,,
647,id127216165398739,"The “Restore Pennsylvania” plan threatens the natural gas industry—a key economic driver and job provider in the commonwealth—and the communities it supports. 

Last year alone, the natural gas industry provided over $250 million in funding for all 67 counties.",CA,CB,,
648,id180790873153477,"Natural gas and oil is empowering a Western Pennsylvania comeback story. Despite its up-and-down past, the region is experiencing significant job growth thanks to a decade of natural gas & oil development in the region - as well as the broader economic benefits of abundant domestic energy. #EnergyForProgress",CA,CB,,
649,id924092271326618,"New Mexico's thriving natural gas and oil industry is contributing billions to state’s general fund in 2018 – for schools, bridges, water treatment plants, and other critical state and local priorities in growing municipalities. #EnergyForProgress",CA,,,
650,id228051458203703,"America's energy revolution helped power Eau Claire, Wisconsin's economic transformation. Innovations in fracking that unlocked vast, energy-rich shale reserves generated a corresponding demand for Wisconsin sand, some of the best for use in fracking. #EnergyForProgress",CB,,,
651,id657153178369801,"Affordable domestic energy boosts Virginia’s economy, supports the area’s robust tourism industry and improves the overall quality of life for all Virginians – especially the commonwealth’s lower-income citizens. #EnergyForProgress",PA,,,
652,id214505776344431,"Homes and businesses throughout Virginia save more than $1,000 annually in energy costs thanks to innovation in natural gas and oil production that have helped to stabilize energy prices and support the area’s workforce. #EnergyForProgress",PA,CB,,
653,id775336742953218,"In Moon Township, Pennsylvania, the natural gas and oil industry supports 18,390 local jobs. #EnergyForProgress",CB,CA,,
654,id129256421681557,"Energy empowers a western PA comeback story. Despite its up-and-down past, the region is experiencing significant job growth thanks to a decade of natural gas & oil development in the region - as well as the broader economic benefits of abundant domestic energy. #EnergyForProgress",CA,CB,,
655,id2410967772528048,Western Wisconsin is home to some of the best industrial sand quarries in the country. Market & Johnson helped build processing facilities in states across the U.S. where fracking has been used to develop natural gas and oil. #EnergyForProgress,CB,,,
656,id2488877434707291,"New Mexico's thriving natural gas and oil industry is contributing billions to state’s general fund – for schools, bridges, water treatment plants, and other critical state and local priorities in growing municipalities. #EnergyForProgress",CA,,,
657,id2489113064679876,"Energy Progress Across America: In Red Wing, Minnesota, the natural gas and oil industry contributes $5.1 Billion to the district economy annually. #EnergyForProgress",CA,,,
658,id1834671209996779,"Today in Red Wing, Minnesota, perhaps more than ever, industrial manufacturing and farming are thriving because of abundant U.S. natural gas and oil – energy that empowers all sectors, benefits consumers, and helps protect the environment. #EnergyForProgress",SA,,,
659,id198980681303091,"Energy Progress Across America: In Eau Claire, Wisconsin, the natural gas and oil industry supports 19,960 local jobs. #EnergyForProgress",CB,,,
660,id840980669700070,"Statewide studies reveal the natural gas and oil industry poured more than $1 billion into the New Mexico schools. In addition, Gov. Michelle Lujan Grisham has proposed free college tuition for all state residents – largely funded by natural gas and oil. #EnergyForProgress",CA,,,
661,id403576107129486,"NEPA has increasingly been misused to delay and prevent infrastructure development, negatively affecting jobs, tax revenue and investments in communities across the country.",CA,CB,,
662,id494025871257286,"Modernizing #NEPA will unlock American investment in modern, efficient infrastructure, creating middle-class sustaining jobs while advancing good environmental stewardship.",CB,,,
663,id1109248762800768,Streamlining NEPA’s burdensome review process could create a building boom that serves as a stimulus for our economy and put thousands of middle-class Americans to work revitalizing our nation’s infrastructure.,CA,CB,,
664,id2501924506740752,"Energy infrastructure is essential to growing American energy leadership, keeping energy costs low for working families and promoting economic development. But red tape is stalling infrastructure projects not just in the energy industry, but across the entire U.S. economy.",SA,PA,CA,
665,id485531709057807,Drone Technology helps carry out high-resolution pipeline scans providing useful and accurate information quickly. Visit our profile to get the #WiderView,PA,,,
666,id192067978663162,"Smart pigs, GPS-equipped devices with sensors, are used to survey the inside of the pipeline and report the location of any cracks to engineers at the command center.",PA,,,
667,id3096090710456219,"The natural gas and oil industry will meet the challenges ahead, for a stronger economy and cleaner future – by expanding partnerships, developing best-in-class standards, driving new technologies, and supporting smarter regulations that boost innovation. #EnergyForProgress",CA,GA,,
668,id476403166388752,"""The work of the problem-solvers of our industry is never done. We are partnering with the best minds to meet the rising demand of affordable energy, while driving progress on the serious challenges posed by climate change.""- API President and CEO, Mike Sommers
#EnergyForProgress",CA,PA,,
669,id539640173595746,"This is Terry, A lifelong citizen of Eau Claire. Today he’s the President of Wisconsin Pipe Trades Association. As the leader of a union thats a vital part of the energy supply chain, he’s seen the benefits of Natural Gas and Oil across all of Wisconsin #EnergyForProgress",CB,,,
670,id581005952454918,"This is Nancy, Executive Vice President of Hunter Truck, making connections right here in Moon Township. #EnergyForProgress",CA,PA,SA,
671,id863290790767807,"This is Ann, a Steamfitter Journeywoman powering big-time projects - from hospitals to schools, to office buildings.  #EnergyForProgress",CB,,,
672,id179768266572146,"This is Sue, as a business and community leader she is forging relationships that build new infrastructure, repair roadways and utilities and ensure all this work keeps New Mexico beautiful. #EnergyForProgress",,,,
673,id584066012141913,"In Las Cruces, New Mexico, the natural gas and oil industry supports 51,100 local jobs. #EnergyForProgress",CB,CA,,
674,id180965453112119,"In Aurora, Colorado abundant domestic natural gas and oil is helping grow the local economy and empowering people, businesses, and manufacturing. #EnergyForProgress",CA,CB,,
675,id525939518034891,"The natural gas and oil industry powers progress in Aurora, CO. #EnergyForProgress",PA,,,
676,id602133923899203,"This is Brian, he works at Extraction Oil & Gas, a company committed to responsible energy development in their community. #EnergyForProgress",CA,CB,,
677,id865154047258226,"This is Kevin, President and CEO of Aurora’s Chamber of Commerce an Aurora citizen for 40 years, Kevin has seen Natural Gas and Oil energize his community. #EnergyForProgress",PA,,,
678,id169748547626757,"Homes and businesses throughout Virginia save more than $1,000 annually in energy costs thanks to innovation in natural gas and oil production that have helped to stabilize energy prices and support the area’s workforce. #SOAE2020 #EnergyForProgress",PA,CB,,
679,id233784280965390,"This is Donnie, President of Mills Marine and Ship Repair and with natural gas and oil, he’s providing career opportunities that change lives forever. #EnergyForProgress",CB,,,
680,id965226893874698,"This is Esmel. He’s a community organizer helping community leaders, residents, and small businesses understand what natural gas and oil make possible. #EnergyForProgress",PA,,,
681,id1258307257709308,"Affordable domestic energy boosts the Virginia’s economy, supports the area’s robust tourism industry and improves the overall quality of life for all Virginians – especially the commonwealth’s lower-income citizens.#SOAE2020 #EnergyForProgress",PA,,,
682,id2633038130258623,"This is Jim, a Director at Red Wing Shoes, a company that has been providing shoes to citizens, soldiers, and everyone in-between since 1905. Today Jim is using natural gas and oil to preserve a local brand with global scale. #EnergyForProgress",SA,,,
683,id111305540293096,"The natural gas and oil industry will meet the challenges ahead, for a stronger economy and cleaner future – by expanding partnerships, developing best-in-class standards, driving new technologies, and supporting smarter regulations that boost innovation.#EnergyForProgress",CA,GA,,
684,id111449076939589,"From decreased energy costs for families to increased investments in school systems and infrastructure, Americans benefit from the economic growth driven by the U.S. natural gas and oil industry. #EnergyForProgress",PA,CA,,
685,id117938629530886,"To grow American energy leadership, we must look to the future and prepare for projections that global energy demand will rise with policies that support safe, responsible domestic natural gas and oil production.#EnergyForProgress",GA,SA,,
686,id126132698577883,"Banning #fracking, the technology most responsible for U.S. energy leadership and emissions reductions, would negatively impact our economy and our national security.",SA,GC,CA,
687,id149643293151476,"""The work of the problem-solvers of our industry is never done. We are partnering with the best minds to meet the rising demand of affordable energy, while driving progress on the serious challenges posed by climate change.""- @APIenergy President and CEO, @MJ_sommers
#EnergyForProgress",CA,PA,,
688,id204247533957058,"Natural gas and oil power America’s 21st-century, economy strengthen our nation’s security and support U.S. global leadership in reducing greenhouse gases.#EnergyForProgress",CA,SA,,
689,id2476172155979582,"American pipelines transport energy safely, using drones, robots, and cloud computing to inspect lines and predict when issues might occur.",PA,,,
690,id516912808950487,Industry investment in carbon capture technology has kept America at the forefront of decreasing emissions. Sign up to get the wider view:,GA,,,
691,id2557853657868422,Increased investment in natural gas infrastructure has brought U.S. emissions to their lowest in a generation even as demand has increased. 🌎 Get the wider view:,GC,,,
692,id2828357180560713,"""The work of the problem-solvers of our industry is never done. We are partnering with the best minds to meet the rising demand of affordable energy, while driving progress on the serious challenges posed by climate change.""- @APIenergy President and CEO, @MJ_sommers #SOAE2020 #EnergyForProgress",CA,PA,,
693,id597162777518631,High-strength steel helps ensure the safe delivery of natural gas and oil to American consumers and businesses. Visit our profile to get the #WiderView,PA,,,
694,id753799325114207,"UAVs are able to produce highly accurate land surveys, aiding ground and aircrews. Visit our profile for the #WiderView",PA,,,
695,id820622825030462,"Advances in seismic imaging technology and data processing have improved how industry engineers ensure the safest, most environmentally friendly pipeline possible.",PA,,,
696,id1435569496614971,"Fiber optic cables allow data to be transmitted across long distances, detecting any stress, vibration or abnormal temperature changes in the pipeline.",PA,,,
697,id1269024319952349,"To grow American energy leadership, we must look to the future and prepare for projections that global energy demand will rise with policies that support safe, responsible domestic natural gas and oil production. #SOAE2020 #EnergyForProgress",GA,SA,,
698,id478634686010823,"The natural gas and oil industry will meet the challenges ahead, for a stronger economy and cleaner future – by expanding partnerships, developing best-in-class standards, driving new technologies, and supporting smarter regulations that boost innovation. #SOAE2020 #EnergyForProgress",CA,GA,,
699,id813302835782536,"Banning #fracking, the technology most responsible for U.S. energy leadership and emissions reductions and by promoting policies that would cost communities across the U.S. jobs and impact our national security. #SOAE2020 #EnergyForProgress",SA,GC,CB,
